{
  "checks": [
    {
      "applicable": true,
      "capability": "spi-v2",
      "cleanupError": null,
      "detail": null,
      "durationMs": 0.19025010988116264,
      "evidence": {
        "capabilityDeclared": true
      },
      "id": "spi-v2-core:capabilities",
      "name": "capabilities",
      "passed": true,
      "phase": "contract",
      "profile": "spi-v2-core",
      "status": "passed"
    },
    {
      "applicable": true,
      "capability": "typed-outcomes",
      "cleanupError": null,
      "detail": null,
      "durationMs": 1.3544580433517694,
      "evidence": {
        "capabilityDeclared": true
      },
      "id": "spi-v2-core:crud-outcomes",
      "name": "crud-outcomes",
      "passed": true,
      "phase": "contract",
      "profile": "spi-v2-core",
      "status": "passed"
    },
    {
      "applicable": true,
      "capability": "batch-inserts",
      "cleanupError": null,
      "detail": null,
      "durationMs": 0.7627499289810658,
      "evidence": {
        "capabilityDeclared": true
      },
      "id": "spi-v2-core:batch-outcomes",
      "name": "batch-outcomes",
      "passed": true,
      "phase": "contract",
      "profile": "spi-v2-core",
      "status": "passed"
    },
    {
      "applicable": true,
      "capability": "operation-context",
      "cleanupError": null,
      "detail": null,
      "durationMs": 0.37599983625113964,
      "evidence": {
        "capabilityDeclared": true
      },
      "id": "spi-v2-core:operation-context",
      "name": "operation-context",
      "passed": true,
      "phase": "contract",
      "profile": "spi-v2-core",
      "status": "passed"
    }
  ],
  "contractVersion": "spi-v2",
  "passed": true,
  "provider": "mongoeco.engines:SQLiteEngine",
  "schemaVersion": "mongoeco-conformance-report/v1",
  "summary": {
    "error": 0,
    "failed": 0,
    "not-applicable": 0,
    "passed": 4
  }
}
